Question,Answers,Category
"After completing the withdrawal transaction, how much time will it take to get funds in my account?","For requests placed until 2 p.m. from Monday to Friday, the amount will be transferred the same day as per RTGS/ NEFT timelines. For requests placed after 2 p.m. and on Saturdays, the amount will be transferred on the next working day.",FAQ
How do I transact through my Flexi loan?,You can do a part-payment through My Account by following these steps:,FAQ
How and when can I foreclose my loan?,You can foreclose your loan any time after paying your first EMI. Follow these steps to foreclose your loan:,FAQ
Do I have to pay any charges when I foreclose my loan?,No foreclosure charges are applicable on EMI finance loans and loans availed of using your EMI Network Card. The following charges apply to other loans:,FAQ
How do I get my No Dues Certificate (NDC)?,"You can view and download your NDC after loan closure.
To get the certificate, follow these steps:",FAQ
Will foreclosing my loan have any impact on my CIBIL score?,"No, there will be no impact of loan foreclosure on your CIBIL score. Once the loan is foreclosed, the same will be reported to CIBIL as closed along with ‘0 outstanding’.",FAQ
When will I get my original documents back after I foreclose my loan?,"If you have any mortgage loan with us, you will receive the same at your nearest Bajaj Finserv branch within 7 working days from the date of foreclosure. For any other loan, all your documents, including security PDCs, will get purged post loan closure.",FAQ
How will I get my foreclosure letter?,Follow these steps to get your foreclosure letter:,FAQ
When do I become liable for tax deducted at source (TDS) on my fixed deposit?,"Under Section 194A of the Income Tax Act, 1961, if the interest earned in a year from investments in fixed deposits floated by NBFCs exceeds Rs. 5,000, the interest income is taxable.",FAQ
When is TDS deducted?,TDS is deducted when the interest amount is credited to the FD holder’s account.,FAQ
"If I have multiple FDs with Bajaj Finance Limited, how will TDS be calculated?","TDS deduction happens against the FD holder’s PAN. Hence, the interest income is arrived at after consolidating all fixed deposits. TDS will be calculated by Bajaj Finance and paid to the government as per the interest payment frequency of the payout scheme selected by the customer.",FAQ
What is the TDS rate?,Tax is deducted at source at rates as mentioned in section 194A of the IT Act 1961. The present rates are as follows:,FAQ
What will the TDS rate be if I do not have a PAN card?,"In the absence of PAN, the TDS rate will be slightly higher. A 20% (including surcharge and education cess) TDS will be applicable.",FAQ
Where can I view the amount deducted against my FD as TDS?,"The amount deducted will reflect in the quarterly TDS certificate issued by Bajaj Finance Limited as per Rule 31 of the Income Tax Rules, 1962. It will also reflect in the FD holder’s statement of account, which can be downloaded from My Account.",FAQ
When does Bajaj Finance Limited issue a TDS certificate?,"As per Rule 31 of the Income Tax Rules, 1962, Bajaj Finance Limited issues a TDS certificate in Form 16A every quarter, within 15 days from the due date of furnishing the statement of tax deducted at source. The due date for the issue of the TDS certificate is given below:",FAQ
What is Form 15G/ 15H?,"Form 15G/ 15H is a self-declaration form that the depositor can submit to avoid TDS if their interest income from fixed deposits is higher than Rs. 5,000, but total income is below the taxable limit.",FAQ
What is the difference between Form 15G and Form 15H?,"Form 15G is meant for resident individuals below 60 years of age, while Form 15H is for those aged 60 years and above during that financial year.",FAQ
Where can I download Form 15G/ H from?,"These forms are readily available at your nearest Bajaj Finance Limited branch. You can also contact your tax consultant for the same. Alternatively, you can visit their website and download the forms online from the ‘Forms/ Download’ section.",FAQ
How will the submission of Form 15G/ H impact TDS deduction?,"If your total taxable income during the financial year is not likely to exceed the taxable limit as per the income tax slab, you can submit Form 15G/ H to Bajaj Finance Limited. From the date of submission of Form 15 G/ H, TDS will not be cut on the interest paid to you.",FAQ
"On submitting Form 15G/ H to Bajaj Finserv, will there be any query from the Income Tax Department?","Since a copy of Form 15G/ H has to be sent to the Income Tax Department, the department may raise a query if they deem it necessary.",FAQ
What is a fixed deposit scheme?,"A fixed deposit scheme is a savings option that helps you earn interest on money parked with Bajaj Finance Limited at periodic intervals, either through simple or compounded interest on the principal amount. The interest rates are typically higher than those of savings accounts because the money is locked in for a specific period and cannot be withdrawn at the will of the depositor, except in certain scenarios in which the customer is ready to bear the prematurity penalty.",FAQ
Who can invest in a Bajaj Finance Limited Fixed Deposit scheme?,"Individuals, companies, Hindu Undivided Families, a body of individuals, associations of persons, societies, trusts, sole proprietorships, partnerships, societies (both residential and credit co-operative), clubs, schools, universities etc., can invest.",FAQ
Who cannot invest in Bajaj Finance Limited Fixed Deposit scheme?,"Non-resident Indians, foreign citizens, persons of Indian origin (PIOs), charitable trusts and entities qualifying under section 11(5) of the Income Tax Act cannot invest in a Bajaj Finance Limited FD scheme.",FAQ
What are the available interest payout options?,"We offer cumulative and non-cumulative interest payment options.
In a non-cumulative fixed deposit scheme, the interest is payable monthly, quarterly, semi-annually and annually. This scheme is convenient if you require periodic interest payment.",FAQ
What are the interest rates offered by Bajaj Finance Limited?,"For information on FD interest rates, email fd@bajajfinserv.in.",FAQ
Will special rates be given to some categories of applicants?,"Yes, senior citizens are eligible for special rates over and above the card rates of interest. Senior citizens (more than 60 years of age, subject to proof of age) can get an additional rate of 0.25% per annum on the size of their deposit. ",FAQ
My loan/ FD with Bajaj Finance Limited has been closed/ has matured. Will I still get a 0.25% existing client benefit while investing in an FD?,"No, you will not be eligible for the benefit.",FAQ
I am an EMI Network Card holder. Will I still get 0.25% existing client benefit while investing in an FD?,"EMI Network Card holders will get the 0.25% existing client benefit only if they have used the card at least once, which means a loan account number has to get created in our records.",FAQ
I have availed of an auto loan from Bajaj Auto Finance Limited. Will I still get the 0.25% existing client benefit while investing in an FD?,"No, you will not.",FAQ
Are there any benefits on FD renewal?,There are no benefits on FD renewal.,FAQ
BFL has just changed the FD rates. Will those new rates apply to my existing deposit?,"No. Since you have locked in your money with us at a specific rate, you will continue to receive interest at that rate till maturity. If you wish to avail of the new rate, you can invest in a new FD with us.",FAQ
What are the benefits of a Bajaj Finance Fixed Deposit?,A Bajaj finance Limited FD has the following features and benefits:,FAQ
What service facilities will be offered to me?,We are a service-oriented organisation focusing on delivering the best service experience. Some of our key highlights are:,FAQ
Will I need to provide any referral for opening a fixed deposit account?,No referrals are required for opening a fixed deposit account.,FAQ
What payment modes can I use?,You can make a payment by cheque or online through RTGS/ NEFT.,FAQ
Can I open a fixed deposit account by cash payment?,"No, you cannot.",FAQ
What documents do I need to submit for opening a fixed deposit account?,Here’s a list of documents you need to provide for opening an account with us.,FAQ
"A senior citizen with a PAN and Aadhaar card has shifted to rented accommodation. The rent agreement is in their son's name and does not contain the senior citizen’s (parent’s) name. In such a case, which documents are needed from the senior citizen to process his FD?","Apart from PAN and Aadhaar details, the senior citizen should fill in their current/correspondence address and tick ‘No’ for “Is current/correspondence address same as permanent address?” on page 1 of the FD application form as shown in the screenshot below. They need not submit proof of correspondence address.",FAQ
Is there any charge/processing fee levied on opening a fixed deposit account?,Opening a fixed deposit account does not attract any charge or processing fee.,FAQ
Can I show my Bajaj Finance FD investment for tax exemption?,A Bajaj Finance FD investment cannot be shown under section 80C for a tax deduction.,FAQ
When will my interest amount be paid?,Your interest amount will be paid as per the following schemes:,FAQ
"Where can I find my FD details like amount, tenor and interest rate?","For these details, you can refer to your FDR or statement of account, available on our customer portal – Experia.",FAQ
I have lost my FD certificate/ receipt. How do I get a new one?,"The original FD receipt is couriered to your address as per our records. If a duplicate FD receipt is required, please submit a written request duly signed by all the FD account holders at our branch.",FAQ
I wish to add a nominee/ change the nominee details on my FD. How can I do so?,"For any request to change the nominee’s name, fill the nomination form available here. Submit the duly signed form to our branch or your relationship manager or broker. Based on this, the changes will be made to our records.",FAQ
When will I receive the TDS certificate?,The TDS certificate will be emailed to the depositor every quarter.,FAQ
How soon will I receive my fixed deposit receipt?,You will receive the fixed deposit receipt by courier within three weeks of creating your deposit account.,FAQ
I am unable to track my fixed deposit receipt (FDR). Please help.,"An FDR tracking system will be made available on our website shortly. Meanwhile, a virtual copy of the FD certificate is available online on our Customer Portal – My Account.",FAQ
What interest amount will be credited to my account?,"Based on the scheme you have chosen, the interest amount will be credited to the bank account in our records. After it is credited to your account, you will receive confirmation via SMS/ email. Refer to your statement of account for the details on the interest scheme you have chosen and details of the interest payable.",FAQ
How will the maturity amount be transferred?,"The maturity amount will be transferred through National Electronic Fund Transfer/ Real Time Gross Settlement modes to the bank account mentioned by you in the application form. The entire amount shall be transferred on the date of maturity of the deposit. If the electronic account transfer bounces, you will be informed by phone, email, and letter to update the bank account details registered with us.",FAQ
How can I change my bank account details?,Download the relevant form from here and submit it with a copy of your FDR and cancelled cheque to your relationship manager/ broker.,FAQ
I have not received the interest on my FD,"If you have not received the interest on your fixed deposit, then follow these three steps to ensure it is credited:",FAQ
How can I renew my FD?,You can renew your FD in the following three ways:,FAQ
Which documents are needed to renew my FD?,We require only the FD application form. You may attach the original FD receipt with it (recommended but not mandatory).,FAQ
Do I need to submit KYC documents along with my photo once again at the time of FD renewal?,No. You don’t have to submit KYC documents and a photo again at the time of FD renewal.,FAQ
"During renewal, can I change the name of the nominee or co-applicant?","Yes, you can change the nominee, but not the co-applicant.",FAQ
Can you give me a loan against my FD if I require money?,"After three months of the lock-in period, FD customers can seek a loan of up to 75% of the deposit amount. The loan interest rate will be 2% higher than the rate at which the deposit was created. The tenor will be the residual maturity of the FD.",FAQ
How to apply for a loan against an FD?,Please contact your relationship manager or branch if you require a loan against FD.,FAQ
Will my FD be impacted if I cannot service the loan taken against my FD?,"No, there will be no impact on the FD. All outstanding dues will be adjusted against the FD maturity proceeds, and the balance will be paid to you.",FAQ
"I already have an outstanding loan (for example, a home loan) with Bajaj Finance Limited and have invested in a Bajaj Finance FD. However, I am unable to service the loan taken. Will my FD be impacted?","No, there will be no impact on the FD. The outstanding dues can’t be adjusted against FD. You may choose to liquidate the FD prematurely and repay the outstanding dues.",FAQ
Is a loan against FD an overdraft facility?,"No, it’s a term loan.",FAQ
I have just repaid my entire loan against FD. Can I avail of a new loan against FD?,"Yes, repaying your earlier loan against FD entirely makes you eligible for a fresh one.",FAQ
Can I avail of any income tax deduction on the EMI I pay on loan against FD?,"No. Income tax deduction is not applicable on the EMIs paid towards a loan against a fixed deposit.
 ",FAQ
Can I avail of a loan from you against an FD of some other NBFC/ bank?,No. We provide loans against Bajaj Finance FDs only.,FAQ
I am a new investor and want to invest in Bajaj Finance FDs. Whom should I get in touch with?,"You can contact your investment advisor, send an email at fd@bajajfinserv.in or call 020-71124281 (charges apply).",FAQ
"I have just submitted my FD application form, and I need to know the status of my application. Whom should I get in touch with?","You can get in touch with your relationship manager/broker, send an email to fd@bajajfinserv.in or call 020-71124281 (charges apply).",FAQ
"I am an existing investor in Bajaj Finance FD, and I have a query. Whom should I get in touch with?","You can contact your regional manager/ broker or raise a request by clicking on the 'No’ button provided below each answer. Select ‘Others’ as the request type to write about your query. Alternatively, you can visit our nearest branch.",FAQ
Is the interest on FD taxable? What is the taxable amount?,"Yes, under Section 194A of the Income Tax Act, 1961, if the interest earned from fixed deposits across all NBFCs exceeds Rs. 5,000, it is taxable. The depositor’s interest income will arrive after consolidating all his fixed deposits. TDS will be calculated by Bajaj Finance and paid to the government quarterly. If the depositor provides 15G/ 15H during the application stage, he will be exempt from paying tax on his interest income.",FAQ
Where can I get and submit Form 15 G/ H?,You can access the form in the following ways:,FAQ
How frequently is TDS deducted?,TDS is deducted quarterly for all modes of payment except monthly.,FAQ
"Even though I had submitted Form 15 G/H, my TDS was deducted. Whom should I get in touch with?","You can contact your relationship manager/broker or raise a request by clicking on the ‘No’ button provided below each answer. To raise a query, select ‘Others’ as the request type.",FAQ
"Can I withdraw my FD before the tenor expires? If yes, what would the impact be on the interest?","The lock-in period for an FD is three months, before which it cannot be withdrawn. For premature withdrawal, there are penalty slabs as follows:",FAQ
The primary applicant has passed away. Can the co-applicant in the FD request for prematurity?,"Yes, the co-applicant has to submit a written request along with the death certificate and the FDR to their relationship manager/broker. The FD proceeds (post deduction of TDS) will be credited to the bank account registered with us within 8 days of receiving the application.",FAQ
The primary applicant has passed away within a few days of investing in an FD. Will Bajaj Finance still deduct TDS in case of premature withdrawal?,"Yes, TDS will be deducted if the FD is withdrawn prematurely.",FAQ
"If the primary applicant expires and there is no nominee or joint holder, what documents are required from the legal heir who wishes to withdraw the FD prematurely?","If a primary applicant with no nominees or joint depositors expires, the legal heir has to submit the following documents:",FAQ
"If the primary applicant dies, then on maturity, can the co-applicant request to renew the FD by adding a new primary applicant?","No, such a deposit cannot be renewed.",FAQ
"If the co-applicant dies, can his name be replaced with another co-applicant during renewal?","No, the deceased co-applicant cannot be replaced with another co-applicant. However, the deceased co-applicant’s name can be deleted from the FD by providing valid documents.",FAQ
"Can the new Karta be made the primary applicant without withdrawing the FD if a Karta dies in an HUF? If yes, what are the documents required? What documents are required from the new Karta who wishes to withdraw the FD prematurely?","In such scenarios, the following documents are required:",FAQ
"If the primary applicant dies, is it mandatory to inform Bajaj Finance Limited about the death?",Yes. That’s because Bajaj Finance Limited cannot continue to pay interest and deduct TDS on the PAN of a deceased person.,FAQ
"A is the primary applicant in one deposit, and B is the joint applicant. Now, for another FD, if B is the primary applicant (and A may or may not be a joint applicant), does B have to submit his KYC documents again?","No. As long as the B’s KYC documents are valid, he need not submit them again.",FAQ
Can an NRI be a co-applicant in an FD?,"No, Bajaj Finance Limited does not accept FDs in which co-applicants are NRIs.",FAQ
A depositor has turned into NRI after creating an FD with Bajaj Finance. What happens to his deposit?,"The deposit can remain with us till maturity. However, if the depositor is an NRI on the renewal date, he cannot renew the deposit; it has to be matured. The maturity proceeds will go to his NRO account only. If he becomes an Indian citizen again (for whatever reason) on the renewal date, he can renew his deposit.",FAQ
Contact us,"To know more, write to us at fd@bajajfinserv.in",FAQ
What are mutual funds?,"A mutual fund is an investment option that consists of pooled money from various investors that is in turn invested in stocks, securities, money market, bonds, etc. These investments are managed by well-qualified professionals. Mutual fund comparison can help in deciding between different options. The funds may be collected as a lump sum amount or through a Systematic Investment Plan (SIP), as per the investment objective and strategy of the fund.",FAQ
What are direct MF plans? How are they different?,"An AMCs (Asset Management Company) offer two plans in mutual funds, i.e. direct plan and regular plan. A direct plan is directly offered to the customers by a fund house without the involvement of agents or third-party distributors. Such plans have a lower expense ratio than regular plans. Apart from the expense ratio and its resultant effect on the NAV, everything else stays the same.",FAQ
"What is KYC, and why is it required?",KYC stands for 'Know Your Customer'. It is a mandatory procedure in India that helps financial institutions verify prospective customers' addresses and identities before conducting transactions.,FAQ
What are the documents required for KYC?,Below are the required documents for individual investors:,FAQ
What are SIP and Lump sum investments?,There are two ways of investing in mutual funds – Lump sum and SIP.,FAQ
How and when can I make a part-prepayment?,"You can make part-payment any time after clearing the first EMI of your Flexi loan account.
Follow these steps to make a part-payment:",FAQ
Do I have to bear any prepayment charges?,Part-payment charges applicable on various products are mentioned below:,FAQ
How do I make an advance payment?,Follow the steps below to make an advance payment:,FAQ
How can I make an overdue payment?,Follow these steps to make an overdue payment online:,FAQ
How do I change my EMI due date?,"Currently, there is no option to change the EMI due date.",FAQ
What is my part-payment limit?,"There is no upper limit to the part payment you can make. However, the daily NEFT transaction limit is predefined by your bank in case you are making a part-payment of above Rs. 20,000. In such a situation, please check the limit with your respective bank.",FAQ
What will happen if part-payment is made by cheque during the presentation period?,"If a part-payment is made by cheque during the presentation period, the effect of the same shall reflect from the next EMI cycle.",FAQ
Where can I find answers to FAQs about the Wallet app?,Find answers to all your Wallet app-related queries here.,FAQ
I am a SuperCard customer. I’m looking for answers to queries about credit cards. Where can I find them?,You can find answers to all your SuperCard-related doubts here.,FAQ
How can I get my certificate of insurance?,"Your policy document/certificate of insurance is dispatched or emailed by the respective insurance company (Bajaj Finserv partner) within five days of policy issuance. If you have not received the policy documents, please raise a request by clicking here.",FAQ
What is the difference between insurance surrender and insurance cancellation?,"A policy can be cancelled within the prescribed free-look period only, as per the terms and conditions. Only a life insurance policy and some health insurance products may acquire a surrender value post the free-look period. When you surrender your policy, you are breaking your contract. The insurer has covered your risk so far, as well as incurred management expenses in maintaining your policy. Thus, you may receive only a portion of what you have paid as the premium, depending upon the policy terms.",FAQ
How to get a refund against insurance cancellation?,The concerned insurance company processes the refund for your insurance policy within 10 working days of registering the request. The refund processing time depends on the mode of application and the terms and conditions of the insurer.,FAQ
How can I register a general insurance claim against the product or asset purchased?,The Certificate of Insurance (COI) provided by your insurance company mentions their helpline/customer service contact details for registering a claim against the policy. You may refer to this to execute your asset/ product claim registration.,FAQ
When will my CIBIL report be updated?,"Your CIBIL report will be updated by the 18th of every month, after EMI payment or loan closure.For any other CIBIL related queries-click here.
",FAQ
How can I raise a request through My Account?,"If you are not satisfied with our answers to your query, please click here to raise a request.",FAQ
I need information on my two-wheeler loan. Please help.,"For queries related to auto loans, please visit our website.",FAQ
How do I apply for a new loan?,"To apply for a new loan now, check your pre-approved offers on My Account by clicking here. If there is no offer available for your desired loan, you can apply online by clicking on ‘Our Portfolio’ in the top menu and then selecting the loan of your choice.",FAQ
What is the taxable event under the Goods and Services Tax (GST)?,A taxable event under GST is the supply of goods or services or both. Central GST (CGST) and State GST (SGST)/ Union Territory GST (UTGST) will be levied on intra-state supplies. Integrated GST (IGST) will be levied on inter-state supplies.,FAQ
What is the meaning of intra-state and inter-state supply?,Intra-state is the supply of goods/ services within a state. Inter-state is the supply of goods/services between two states.,FAQ
What is an input tax credit?,"The taxes you pay on input or purchase of goods/services is called input tax credit (ITC), whereas output tax liability is the tax paid on the final product.",FAQ
What if the input tax credit does not match the details provided in the GST return?,"If the input tax credit does not match the details provided in the GST return, the taxpayer will not get the same credit. Hence it is required that every detail of input tax credit be matched to get the credit.",FAQ
When will an invoice or a supply bill be issued to the customer?,"The supplier usually generates the invoice if the supply of goods and services exceeds Rs. 200. However, if registered under GST, the supplier will raise an invoice with GST regardless of the taxable value. The time for issuing an invoice with GST will depend on the supply type, i.e. goods and services.",FAQ
On what types of fees or charges would GST be applicable?,Here is a list of fees or charges on which GST would be applicable:,FAQ
What is the applicable GST rate for the above fees or charges?,The applicable GST rate for the above charges or fees is 18%.,FAQ
What are the GST registration details of Bajaj Finance?,Please look at the table below for our state-wise GST registration details:,FAQ
What are the payment modes that I can use for bill payment in Bajaj Finserv Website?,"Mentioned below are the modes of payment available to pay your bills and recharge-related transactions:
- Debit card
- Credit card
- UPI
- Internet Banking
",FAQ
